{
  "schema": "yapcad-viewer-session-v1",
  "sessionId": "77777777-7777-4777-8777-777777777777",
  "revision": 0,
  "package": {
    "name": "YapRover suspension prototype",
    "version": "0.1.0",
    "digest": "sha256:e1b67056e95f7d46e337b06f83cf678b1a147c56efc7519cf3a61957dc4ff90e",
    "rootPartId": "chassis"
  },
  "components": [
    {
      "id": "chassis-proxy",
      "name": "Chassis tub",
      "description": "YapRover suspension showcase component",
      "disposition": "make",
      "quantityPerInstance": 1.0,
      "unit": "each",
      "partNumber": null,
      "revision": "A",
      "materialId": "petg",
      "manufacturing": {
        "process": "FDM",
        "material": "PET-G"
      },
      "procurement": null,
      "pmi": null,
      "assetDigest": "sha256:25e5a28d9336083fed9b2fca9ea064234363b35b409aeb5e9d9b667c918113df"
    },
    {
      "id": "rocker-proxy",
      "name": "Rocker link",
      "description": "YapRover suspension showcase component",
      "disposition": "make",
      "quantityPerInstance": 1.0,
      "unit": "each",
      "partNumber": null,
      "revision": "A",
      "materialId": "petg",
      "manufacturing": {
        "process": "FDM",
        "material": "PET-G"
      },
      "procurement": null,
      "pmi": null,
      "assetDigest": "sha256:bbbb0f9d7b1c97dff6d4cd99721633932ba14ff84696cdaba5cb90a3e4726d3f"
    },
    {
      "id": "bogie-proxy",
      "name": "Bogie link",
      "description": "YapRover suspension showcase component",
      "disposition": "make",
      "quantityPerInstance": 1.0,
      "unit": "each",
      "partNumber": null,
      "revision": "A",
      "materialId": "petg",
      "manufacturing": {
        "process": "FDM",
        "material": "PET-G"
      },
      "procurement": null,
      "pmi": null,
      "assetDigest": "sha256:83337c271eb930bd1a778cd490bb10bac5c64e92ad5b3e6a4eb43e468a11b49f"
    },
    {
      "id": "wheel-proxy",
      "name": "Wheel and hub",
      "description": "YapRover suspension showcase component",
      "disposition": "make",
      "quantityPerInstance": 1.0,
      "unit": "each",
      "partNumber": null,
      "revision": "A",
      "materialId": "petg",
      "manufacturing": {
        "process": "FDM",
        "material": "PET-G"
      },
      "procurement": null,
      "pmi": null,
      "assetDigest": "sha256:ca60f390d122ad12d18b04912210c391d307dfc43bad5f8b22c36e5e35725ad8"
    }
  ],
  "parts": [
    {
      "id": "chassis",
      "name": "Chassis",
      "componentId": "chassis-proxy",
      "parentId": null,
      "materialId": "petg",
      "assetDigest": "sha256:25e5a28d9336083fed9b2fca9ea064234363b35b409aeb5e9d9b667c918113df",
      "transform": [
        1.0,
        0.0,
        0.0,
        0.0,
        0.0,
        1.0,
        0.0,
        0.0,
        0.0,
        0.0,
        1.0,
        0.0,
        0.0,
        0.0,
        0.0,
        1.0
      ],
      "datums": [
        {
          "id": "left_rocker",
          "kind": "axis",
          "origin": [
            0.0,
            155.0,
            0.0
          ],
          "direction": [
            0.0,
            1.0,
            0.0
          ]
        },
        {
          "id": "right_rocker",
          "kind": "axis",
          "origin": [
            0.0,
            -155.0,
            0.0
          ],
          "direction": [
            0.0,
            1.0,
            0.0
          ]
        }
      ],
      "visible": true
    },
    {
      "id": "left_rocker",
      "name": "Left rocker",
      "componentId": "rocker-proxy",
      "parentId": "chassis",
      "materialId": "petg",
      "assetDigest": "sha256:bbbb0f9d7b1c97dff6d4cd99721633932ba14ff84696cdaba5cb90a3e4726d3f",
      "transform": [
        0.9902680687415704,
        0.0,
        -0.13917310096006544,
        0.0,
        0.0,
        1.0,
        0.0,
        0.0,
        0.13917310096006544,
        0.0,
        0.9902680687415704,
        0.0,
        0.0,
        155.0,
        0.0,
        1.0
      ],
      "datums": [
        {
          "id": "chassis_pivot",
          "kind": "axis",
          "origin": [
            0.0,
            0.0,
            0.0
          ],
          "direction": [
            0.0,
            1.0,
            0.0
          ]
        },
        {
          "id": "front_axle",
          "kind": "axis",
          "origin": [
            190.0,
            0.0,
            -75.0
          ],
          "direction": [
            0.0,
            1.0,
            0.0
          ]
        },
        {
          "id": "bogie_pivot",
          "kind": "axis",
          "origin": [
            -95.0,
            0.0,
            -35.0
          ],
          "direction": [
            0.0,
            1.0,
            0.0
          ]
        }
      ],
      "visible": true
    },
    {
      "id": "right_rocker",
      "name": "Right rocker",
      "componentId": "rocker-proxy",
      "parentId": "chassis",
      "materialId": "petg",
      "assetDigest": "sha256:bbbb0f9d7b1c97dff6d4cd99721633932ba14ff84696cdaba5cb90a3e4726d3f",
      "transform": [
        0.9902680687415704,
        0.0,
        0.13917310096006544,
        0.0,
        0.0,
        1.0,
        0.0,
        0.0,
        -0.13917310096006544,
        0.0,
        0.9902680687415704,
        0.0,
        0.0,
        -155.0,
        0.0,
        1.0
      ],
      "datums": [
        {
          "id": "chassis_pivot",
          "kind": "axis",
          "origin": [
            0.0,
            0.0,
            0.0
          ],
          "direction": [
            0.0,
            1.0,
            0.0
          ]
        },
        {
          "id": "front_axle",
          "kind": "axis",
          "origin": [
            190.0,
            0.0,
            -75.0
          ],
          "direction": [
            0.0,
            1.0,
            0.0
          ]
        },
        {
          "id": "bogie_pivot",
          "kind": "axis",
          "origin": [
            -95.0,
            0.0,
            -35.0
          ],
          "direction": [
            0.0,
            1.0,
            0.0
          ]
        }
      ],
      "visible": true
    },
    {
      "id": "left_bogie",
      "name": "Left bogie",
      "componentId": "bogie-proxy",
      "parentId": "left_rocker",
      "materialId": "petg",
      "assetDigest": "sha256:83337c271eb930bd1a778cd490bb10bac5c64e92ad5b3e6a4eb43e468a11b49f",
      "transform": [
        0.9902680687415704,
        0.0,
        -0.13917310096006544,
        0.0,
        0.0,
        1.0,
        0.0,
        0.0,
        0.13917310096006544,
        0.0,
        0.9902680687415704,
        0.0,
        -98.94652506405149,
        155.0,
        -21.437937814748746,
        1.0
      ],
      "datums": [
        {
          "id": "rocker_pivot",
          "kind": "axis",
          "origin": [
            0.0,
            0.0,
            0.0
          ],
          "direction": [
            0.0,
            1.0,
            0.0
          ]
        },
        {
          "id": "middle_axle",
          "kind": "axis",
          "origin": [
            95.0,
            0.0,
            -40.0
          ],
          "direction": [
            0.0,
            1.0,
            0.0
          ]
        },
        {
          "id": "rear_axle",
          "kind": "axis",
          "origin": [
            -95.0,
            0.0,
            -40.0
          ],
          "direction": [
            0.0,
            1.0,
            0.0
          ]
        }
      ],
      "visible": true
    },
    {
      "id": "right_bogie",
      "name": "Right bogie",
      "componentId": "bogie-proxy",
      "parentId": "right_rocker",
      "materialId": "petg",
      "assetDigest": "sha256:83337c271eb930bd1a778cd490bb10bac5c64e92ad5b3e6a4eb43e468a11b49f",
      "transform": [
        0.9902680687415704,
        0.0,
        0.13917310096006544,
        0.0,
        0.0,
        1.0,
        0.0,
        0.0,
        -0.13917310096006544,
        0.0,
        0.9902680687415704,
        0.0,
        -89.2044079968469,
        -155.0,
        -47.88082699716118,
        1.0
      ],
      "datums": [
        {
          "id": "rocker_pivot",
          "kind": "axis",
          "origin": [
            0.0,
            0.0,
            0.0
          ],
          "direction": [
            0.0,
            1.0,
            0.0
          ]
        },
        {
          "id": "middle_axle",
          "kind": "axis",
          "origin": [
            95.0,
            0.0,
            -40.0
          ],
          "direction": [
            0.0,
            1.0,
            0.0
          ]
        },
        {
          "id": "rear_axle",
          "kind": "axis",
          "origin": [
            -95.0,
            0.0,
            -40.0
          ],
          "direction": [
            0.0,
            1.0,
            0.0
          ]
        }
      ],
      "visible": true
    },
    {
      "id": "left_front_wheel",
      "name": "Left front wheel",
      "componentId": "wheel-proxy",
      "parentId": "left_rocker",
      "materialId": "petg",
      "assetDigest": "sha256:ca60f390d122ad12d18b04912210c391d307dfc43bad5f8b22c36e5e35725ad8",
      "transform": [
        0.9902680687415704,
        0.0,
        -0.13917310096006544,
        0.0,
        0.0,
        1.0,
        0.0,
        0.0,
        0.13917310096006544,
        0.0,
        0.9902680687415704,
        0.0,
        177.71295048889348,
        155.0,
        -100.71299433803021,
        1.0
      ],
      "datums": [
        {
          "id": "axle",
          "kind": "axis",
          "origin": [
            0.0,
            0.0,
            0.0
          ],
          "direction": [
            0.0,
            1.0,
            0.0
          ]
        }
      ],
      "visible": true
    },
    {
      "id": "left_middle_wheel",
      "name": "Left middle wheel",